{
  "as_of": "2026-07-26T12:00:00+10:00",
  "horizon_trading_days": 90,
  "locale": "zh-CN",
  "objective": "RISK_ADJUSTED_DECISION_SUPPORT",
  "requested_mode": "DEEP_DIVE",
  "schema": "equity-event-atlas/request-v1",
  "security": {
    "currency": "USD",
    "instrument_type": "COMMON_STOCK",
    "mic": "XNAS",
    "name": "合成航天公司",
    "ticker": "SYN"
  },
  "user_context": {
    "max_event_exposure": "当前持仓的 35%",
    "position_status": "HOLDING",
    "risk_budget": "BALANCED"
  }
}
